<?xml version="1.0" encoding="UTF-8"?>
<!-- Auteur Styven Drui -->
<!DOCTYPE movie SYSTEM "movie.dtd">
<movie annee_sortie="2011" durée="114min">
    <fiche_technique>
        <producteur prenom="Stan" nom="Lee"/>
        <producteur prenom="Kevin" nom="Feige"/>
        <producteur prenom="Jaimie" nom="Alexander"/>
        <producteur prenom="Victoria" nom="Alonso"/>
        <producteur prenom="Craig" nom="Kyle"/>
        <budget>150 000 000 $</budget>
        <realisateur prenom="Kenneth" nom="Branagh"/>
        <scenariste prenom="Ashley" nom="Miller"/>
        <scenariste prenom="Zack" nom="Stentz"/>
        <scenariste prenom="Don" nom="Payne"/>
        <main_actors>
            <actor prenom="Chris" nom="Hemsworth"/>
            <actor prenom="Natalie" nom="Portman"/>
            <actor prenom="Tom" nom="Hiddleston"/>
            <actor prenom="Anthony" nom="Hopkins"/>
        </main_actors>
        <société_prod>Marvel Studios</société_prod>
    </fiche_technique>
    <synopsis>Le roi Odin règne avec sagesse sur son royaume. Une entente maintient la paix avec les Géants du monde
        glacé de Jotunheim.
        Les gestes irréfléchis du jeune Thor, pressenti pour prendre la place de son père sur le trône,
        mettent cependant en péril la paix fragile entre les deux peuples, ce qui pousse son père à le bannir sur Terre.
        Dépouillé de ses pouvoirs, Thor doit apprendre la véritable valeur d'un roi. Pendant ce temps,
        le demi-frère de Thor essaie de prendre possession du trône.
    </synopsis>
    <bande_originale>
        <son numero="1" titre="Chasing the Storm" longeur="3:11"/>
        <son numero="2" titre="Prologue" longeur="3:09"/>
        <son numero="3" titre="Sons of Odin" longeur="1:48"/>
        <son numero="4" titre="A New King" longeur="3:00"/>
        <son numero="5" titre="Ride to Observatory" longeur="2:10"/>
        <son numero="6" titre="To Jotunheim" longeur="2:19"/>
        <son numero="7" titre="Laufey" longeur="3:40"/>
        <son numero="8" titre="Frost Giant Battle" longeur="4:22"/>
        <son numero="9" titre="Banishment" longeur="1:53"/>
        <son numero="10" titre="Crisis In Asgard" longeur="2:18"/>
        <son numero="11" titre="Odin Confesses" longeur="2:43"/>
        <son numero="12" titre="Hammer Found" longeur="1:11"/>
        <son numero="13" titre="Urgent Matter" longeur="2:21"/>
        <son numero="14" titre="The Compound" longeur="7:40"/>
        <son numero="15" titre="Loki’s Lie" longeur="1:54"/>
        <son numero="16" titre="My Bastard Son" longeur="2:39"/>
        <son numero="17" titre="Science and Magic" longeur="2:53"/>
        <son numero="18" titre="The Destroyer" longeur="2:57"/>
        <son numero="19" titre="Forgive Me" longeur="2:40"/>
        <son numero="20" titre="Thor Kills the Destroyer" longeur="1:53"/>
        <son numero="21" titre="Brothers Fight" longeur="6:59"/>
        <son numero="22" titre="Letting Go" longeur="3:17"/>
        <son numero="23" titre="Can You See Jane?" longeur="2:23"/>
        <son numero="24" titre="Earth to Asgard" longeur="2:33"/>
    </bande_originale>
    <note>57</note>
    <box_office>449 326 618 $</box_office>
    <distinctions>
        <nomination type="Teen Choice Awards 2011">révélation masculine de l'année pour Chris Hemsworth</nomination>
        <nomination type="MTV Movie Awards 2012">meilleur héros pour Chris Hemsworth</nomination>
    </distinctions>
    <photo src="thor-image.jpg" alt="Thor"/>
</movie>